### ISSUE TITLE
Won't reach internet from created subnet

### ISSUE THREAD

**Issue by XantheFIN** [infusion/node-dhcp#54]
Got here so best open new ticket as so different than earlier issue which was fixed already. 

Now i have configs which works so that it does provide IP's. But i don't get internet connection. Not sure does it get send but feels like not result back in..?
-WinXP laptop still fails get IP-#Other problem

Maybe i have little problem still with config.. i have tried done:
`sudo route add -host 255.255.255.255 -interface en4`

**No network (yet..)**
I get to send request of ping from inside this network but it doesn't get answer (or other way around.. i can't say myself). There is no response to ping 8.8.8.8 dns even.
wireshark picture under..

![Screen Shot 2019-07-19 at 10 35 38 PM](https://user-images.githubusercontent.com/6132150/61560688-a48b5100-aa75-11e9-85dd-963190f0f6b1.png)

**Trying just:**
I thought fake how InternetSharing does it.. combine dns to router address

Now i get port unreachable.. so better or worse? 
![Screen Shot 2019-07-19 at 11 44 16 PM](https://user-images.githubusercontent.com/6132150/61564558-6135e000-aa7f-11e9-8131-a8983ca97be4.png)

Any ideas? #Update InternetSharing does create bridge0 too.

Do i need have manual config in SystemPreferences and what style? if it makes differences..

**Update:**
Been log how InternetShare does all.

At DHCP offer it gives 
`Internet Protocol Version 4, Src: 192.168.2.1, Dst: 192.168.2.4`

So there is Src: Router IP, Dst: New device IP

this dhcp gives when i try WinXP laptop:

Internet Protocol Version 4, Src: 1.1.1.11, Dst: 1.1.1.255

So it is.. Router IP but the Broadcast ip? Hmm..

from **sudo tcpdump -i en0**

```
17:40:56.796391 IP 1.1.1.11.bootps > 1.1.1.255.bootpc: BOOTP/DHCP, Reply, length 290
17:40:56.796760 IP 0.0.0.0.bootpc > broadcasthost.bootps: BOOTP/DHCP, Request from 00:1f:PS3 (oui Unknown), length 300
17:40:56.797664 IP 1.1.1.11.bootps > 1.1.1.255.bootpc: BOOTP/DHCP, Reply, length 290
17:40:56.797891 ARP, Probe 1.1.1.79, length 46
17:40:57.297002 ARP, Announcement 1.1.1.79, length 46
17:40:57.297162 ARP, Announcement 1.1.1.79, length 46
17:40:57.485661 ARP, Request who-has 1.1.1.11 tell 1.1.1.79, length 46
17:40:57.485694 ARP, Reply 1.1.1.11 is-at 8c:ethernet (oui Unknown), length 28
17:40:57.485949 IP 1.1.1.79.49556 > dns.google.domain: 55586+ A? feu01.ps3.update.playstation.net. (50)
```

**Comment by XantheFIN** [comment]
This was more likely likely a feature than issue. It doesn't connect subnet to network on macOS Sierra. It needs a extra steps which InternetSharing does like creating completely new Interface. InternetSharing is disabled while using this if it matters.

**Comment by XantheFIN** [comment]
I confirm this was OS issue on newer macOS.. needed do some trickery to get internet shared but now works internet on subnet i create with this too. Hit message if anyone needed it.
